{
  "classification": {
    "entity_type": null,
    "evidence": [],
    "original_classification": null,
    "reason": "CSV_HAS_NO_AUTHORITATIVE_TYPE_COLUMN",
    "type_status": "UNREVIEWED"
  },
  "entity_type": "source_record",
  "execution_permission_granted": false,
  "identity_namespace": "grokbot",
  "knowledge_values_complete": true,
  "native_source_id": "M0102",
  "new_execution_trials": 0,
  "provenance": {
    "csv_row_ordinal": 102,
    "csv_sha256": "15cc0ecbcb23261e3cd7f2fb0851815daed59951090d9ce3e759ef224ea6f415",
    "row_sha256": "83c19ff418be831d20d6bb5d6d5e6465231605c2265e885fcad82d4ff8013d7d",
    "rule_sha256": "c4fa165c0dc8cbb226304e9c987e2716b9171a26b8220486631077ddd5388e32"
  },
  "publication": {
    "all_fields_reviewed": false,
    "reason_codes": [],
    "sensitive_fields": [],
    "status": "FIELD_REVIEW_REQUIRED"
  },
  "record_id": "M0102",
  "reported_fields": {
    "id": {
      "status": "CATALOG_REPORTED_UNVERIFIED",
      "value": "M0102"
    },
    "source_url": {
      "status": "CATALOG_REPORTED_UNVERIFIED",
      "value": "https://github.com/paperswithbacktest/awesome-systematic-trading/blob/main/static/strategies/short-interest-effect-long-short-version.py"
    },
    "作者或机构": {
      "status": "CATALOG_REPORTED_UNVERIFIED",
      "value": "paperswithbacktest"
    },
    "别名来源": {
      "status": "CATALOG_REPORTED_UNVERIFIED",
      "value": ""
    },
    "可回测": {
      "status": "CATALOG_REPORTED_UNVERIFIED",
      "value": "中"
    },
    "名称": {
      "status": "CATALOG_REPORTED_UNVERIFIED",
      "value": "空头兴趣多空"
    },
    "市场": {
      "status": "CATALOG_REPORTED_UNVERIFIED",
      "value": "美股"
    },
    "提出日期": {
      "status": "CATALOG_REPORTED_UNVERIFIED",
      "value": "未知"
    },
    "标题": {
      "status": "CATALOG_REPORTED_UNVERIFIED",
      "value": "空头兴趣多空"
    },
    "规则": {
      "status": "CATALOG_REPORTED_UNVERIFIED",
      "value": "美股按空头兴趣相对流通股比例分十档，做多最低、做空最高，等权、每月再平衡；源码用固定大盘名单而非全市场。"
    },
    "页码或文件": {
      "status": "CATALOG_REPORTED_UNVERIFIED",
      "value": "short-interest-effect-long-short-version.py"
    }
  },
  "schema_version": "quantgraph-catalog-source-record/v1",
  "source_webpage_fulltext_fetched": false
}
