{
  "classification": {
    "entity_type": null,
    "evidence": [],
    "original_classification": null,
    "reason": "CSV_HAS_NO_AUTHORITATIVE_TYPE_COLUMN",
    "type_status": "UNREVIEWED"
  },
  "entity_type": "source_record",
  "execution_permission_granted": false,
  "identity_namespace": "grokbot",
  "knowledge_values_complete": true,
  "native_source_id": "M0905",
  "new_execution_trials": 0,
  "provenance": {
    "csv_row_ordinal": 905,
    "csv_sha256": "15cc0ecbcb23261e3cd7f2fb0851815daed59951090d9ce3e759ef224ea6f415",
    "row_sha256": "d4155ffae1b1407ffd0aa3ab8cc6c0391b742071a2c6c5dd09a7df8d224d331b",
    "rule_sha256": "0cb7c0c2dfda2b2352d75a2c301d52a0214cc5aaf3977b454b040b3bb739ba95"
  },
  "publication": {
    "all_fields_reviewed": false,
    "reason_codes": [],
    "sensitive_fields": [],
    "status": "FIELD_REVIEW_REQUIRED"
  },
  "record_id": "M0905",
  "reported_fields": {
    "id": {
      "status": "CATALOG_REPORTED_UNVERIFIED",
      "value": "M0905"
    },
    "source_url": {
      "status": "CATALOG_REPORTED_UNVERIFIED",
      "value": "https://www.quantconnect.com/strategies/283/quality-value-large-cap-hrp-risk-parity/"
    },
    "作者或机构": {
      "status": "CATALOG_REPORTED_UNVERIFIED",
      "value": "Daniel Paxton"
    },
    "别名来源": {
      "status": "CATALOG_REPORTED_UNVERIFIED",
      "value": "无"
    },
    "可回测": {
      "status": "CATALOG_REPORTED_UNVERIFIED",
      "value": "高"
    },
    "名称": {
      "status": "CATALOG_REPORTED_UNVERIFIED",
      "value": "质量价值大盘HRP：P/E 5–20、毛利率>70%、债务/权益>0.5，市值最大最多50只，300日收益，每28天HRP"
    },
    "市场": {
      "status": "CATALOG_REPORTED_UNVERIFIED",
      "value": "美股"
    },
    "提出日期": {
      "status": "CATALOG_REPORTED_UNVERIFIED",
      "value": "2026-02-14"
    },
    "标题": {
      "status": "CATALOG_REPORTED_UNVERIFIED",
      "value": "Quality-Value Large-Cap HRP Risk Parity"
    },
    "规则": {
      "status": "CATALOG_REPORTED_UNVERIFIED",
      "value": "债务/权益 >0.5 按页面原样保留，这是高杠杆门槛，不改成低杠杆。本条只写该公开策略页已印出的 P/E 5–20、毛利率 >70%、债务/权益 >0.5、大流动性公司里市值最大的最多 50 只、300 个交易日收益估计、每 28 天按相关性聚类并用 HRP 递归分配、再平衡时清算不再符合历史资格的持仓。不是已收的加密层次风险平价：那边每月取 Coinbase 美元成交量前 10 的非稳定币、约 12 个月收益层次聚类后逆方差。也不是每季度 252 日总收益前 20 再做 252 日相关 HRP。也不是 SPY 成分股前 200 相关距离聚类的层次等风险。主文件没有已印出这组市盈率、毛利率与债务/权益筛选的大盘 HRP。日收盘数据。计入美股/ETF。提出日期按源文件原样保留2026-02-14。"
    },
    "页码或文件": {
      "status": "CATALOG_REPORTED_UNVERIFIED",
      "value": "公开策略详情页"
    }
  },
  "schema_version": "quantgraph-catalog-source-record/v1",
  "source_webpage_fulltext_fetched": false
}
