{
  "classification": {
    "entity_type": null,
    "evidence": [],
    "original_classification": null,
    "reason": "CSV_HAS_NO_AUTHORITATIVE_TYPE_COLUMN",
    "type_status": "UNREVIEWED"
  },
  "entity_type": "source_record",
  "execution_permission_granted": false,
  "identity_namespace": "grokbot",
  "knowledge_values_complete": true,
  "native_source_id": "M0241",
  "new_execution_trials": 0,
  "provenance": {
    "csv_row_ordinal": 241,
    "csv_sha256": "15cc0ecbcb23261e3cd7f2fb0851815daed59951090d9ce3e759ef224ea6f415",
    "row_sha256": "494a79059b4cf56eabbc8bfffbb4dd38a0889c616d7a8d7f595c571fbb0ea10a",
    "rule_sha256": "ac160ab6959f3b9fd4f45530117472a0ca9464cd289965d701ccbe1abce09cc6"
  },
  "publication": {
    "all_fields_reviewed": false,
    "reason_codes": [],
    "sensitive_fields": [],
    "status": "FIELD_REVIEW_REQUIRED"
  },
  "record_id": "M0241",
  "reported_fields": {
    "id": {
      "status": "CATALOG_REPORTED_UNVERIFIED",
      "value": "M0241"
    },
    "source_url": {
      "status": "CATALOG_REPORTED_UNVERIFIED",
      "value": "https://github.com/freqtrade/freqtrade-strategies/blob/main/user_data/strategies/futures/VolatilitySystem.py"
    },
    "作者或机构": {
      "status": "CATALOG_REPORTED_UNVERIFIED",
      "value": "freqtrade/freqtrade-strategies"
    },
    "别名来源": {
      "status": "CATALOG_REPORTED_UNVERIFIED",
      "value": ""
    },
    "可回测": {
      "status": "CATALOG_REPORTED_UNVERIFIED",
      "value": "高"
    },
    "名称": {
      "status": "CATALOG_REPORTED_UNVERIFIED",
      "value": "VolatilitySystem"
    },
    "市场": {
      "status": "CATALOG_REPORTED_UNVERIFIED",
      "value": "加密永续"
    },
    "提出日期": {
      "status": "CATALOG_REPORTED_UNVERIFIED",
      "value": "未知"
    },
    "标题": {
      "status": "CATALOG_REPORTED_UNVERIFIED",
      "value": "VolatilitySystem"
    },
    "规则": {
      "status": "CATALOG_REPORTED_UNVERIFIED",
      "value": "1h 可做空；ATR(14)×2；收盘变化上穿 ATR 做多、反向变化上穿 ATR 做空；止损 -100%（实质上靠信号出场）。"
    },
    "页码或文件": {
      "status": "CATALOG_REPORTED_UNVERIFIED",
      "value": "VolatilitySystem.py"
    }
  },
  "schema_version": "quantgraph-catalog-source-record/v1",
  "source_webpage_fulltext_fetched": false
}
