{
  "classification": {
    "entity_type": null,
    "evidence": [],
    "original_classification": null,
    "reason": "CSV_HAS_NO_AUTHORITATIVE_TYPE_COLUMN",
    "type_status": "UNREVIEWED"
  },
  "entity_type": "source_record",
  "execution_permission_granted": false,
  "identity_namespace": "grokbot",
  "knowledge_values_complete": true,
  "native_source_id": "M5490",
  "new_execution_trials": 0,
  "provenance": {
    "csv_row_ordinal": 5444,
    "csv_sha256": "15cc0ecbcb23261e3cd7f2fb0851815daed59951090d9ce3e759ef224ea6f415",
    "row_sha256": "329ec4b8816d41100e47acc90a7eb37e0b6ab41caeebb6a7b61e78d02bc1b429",
    "rule_sha256": "6f5388788ea83abcc84f644c9be6dd7943550869959576d6f9704a5f5363da1c"
  },
  "publication": {
    "all_fields_reviewed": false,
    "reason_codes": [],
    "sensitive_fields": [],
    "status": "FIELD_REVIEW_REQUIRED"
  },
  "record_id": "M5490",
  "reported_fields": {
    "id": {
      "status": "CATALOG_REPORTED_UNVERIFIED",
      "value": "M5490"
    },
    "source_url": {
      "status": "CATALOG_REPORTED_UNVERIFIED",
      "value": "https://chartschool.stockcharts.com/table-of-contents/technical-indicators-and-overlays/technical-indicators/stochrsi"
    },
    "作者或机构": {
      "status": "CATALOG_REPORTED_UNVERIFIED",
      "value": "Tushar Chande / Stanley Kroll / StockCharts ChartSchool"
    },
    "别名来源": {
      "status": "CATALOG_REPORTED_UNVERIFIED",
      "value": "quant-web-harvest-260/W2701"
    },
    "可回测": {
      "status": "CATALOG_REPORTED_UNVERIFIED",
      "value": "高"
    },
    "名称": {
      "status": "CATALOG_REPORTED_UNVERIFIED",
      "value": "Chande/StockCharts·StochRSI中轴：日频；StochRSI(14)>0.5持SPY否则BIL（StochRSI·Mid·SPY）"
    },
    "市场": {
      "status": "CATALOG_REPORTED_UNVERIFIED",
      "value": "美股/ETF"
    },
    "提出日期": {
      "status": "CATALOG_REPORTED_UNVERIFIED",
      "value": "1994-01-01"
    },
    "标题": {
      "status": "CATALOG_REPORTED_UNVERIFIED",
      "value": "StochRSI Centerline — SPY"
    },
    "规则": {
      "status": "CATALOG_REPORTED_UNVERIFIED",
      "value": "本条只写 StockCharts ChartSchool《StochRSI》之 **中轴/短趋势** 核（Chande & Kroll）。日频EOD：先算 RSI(14)，再 StochRSI=(RSI−14日最低RSI)/(14日最高RSI−14日最低RSI)；若 **StochRSI>0.5** → 满仓 **SPY**，否则 **BIL**。不是0.20/0.80超买超卖交叉；不是周频。计入美股/ETF。提出日期 1994-01-01。"
    },
    "页码或文件": {
      "status": "CATALOG_REPORTED_UNVERIFIED",
      "value": "StochRSI·Mid·SPY"
    }
  },
  "schema_version": "quantgraph-catalog-source-record/v1",
  "source_webpage_fulltext_fetched": false
}
