{
  "classification": {
    "entity_type": null,
    "evidence": [],
    "original_classification": null,
    "reason": "CSV_HAS_NO_AUTHORITATIVE_TYPE_COLUMN",
    "type_status": "UNREVIEWED"
  },
  "entity_type": "source_record",
  "execution_permission_granted": false,
  "identity_namespace": "grokbot",
  "knowledge_values_complete": true,
  "native_source_id": "M2297",
  "new_execution_trials": 0,
  "provenance": {
    "csv_row_ordinal": 2297,
    "csv_sha256": "15cc0ecbcb23261e3cd7f2fb0851815daed59951090d9ce3e759ef224ea6f415",
    "row_sha256": "a85c5ba05a5a5d0dfc3b62a357a1874db052e95e1bea44dacb427e8eb8eb5540",
    "rule_sha256": "a645b0bc1952334a486c0547a1462cde51f1da8578bf56df1690fd9b4967994f"
  },
  "publication": {
    "all_fields_reviewed": false,
    "reason_codes": [],
    "sensitive_fields": [],
    "status": "FIELD_REVIEW_REQUIRED"
  },
  "record_id": "M2297",
  "reported_fields": {
    "id": {
      "status": "CATALOG_REPORTED_UNVERIFIED",
      "value": "M2297"
    },
    "source_url": {
      "status": "CATALOG_REPORTED_UNVERIFIED",
      "value": "https://finance.sina.com.cn/stock/marketresearch/2025-05-31/doc-ineymsee1844346.shtml"
    },
    "作者或机构": {
      "status": "CATALOG_REPORTED_UNVERIFIED",
      "value": "华泰证券金工（新浪转载《再论A股择时：多维度融合》；2025-05-29）"
    },
    "别名来源": {
      "status": "CATALOG_REPORTED_UNVERIFIED",
      "value": "无"
    },
    "可回测": {
      "status": "CATALOG_REPORTED_UNVERIFIED",
      "value": "高"
    },
    "名称": {
      "status": "CATALOG_REPORTED_UNVERIFIED",
      "value": "华泰金工融资买入额布林带择时（流量突破上轨做多/下轨做空）"
    },
    "市场": {
      "status": "CATALOG_REPORTED_UNVERIFIED",
      "value": "A股（万得全A；日频；右侧跟随）"
    },
    "提出日期": {
      "status": "CATALOG_REPORTED_UNVERIFIED",
      "value": "2025-05-29"
    },
    "标题": {
      "status": "CATALOG_REPORTED_UNVERIFIED",
      "value": "华泰金工融资买入额布林带择时（流量突破上轨做多/下轨做空）"
    },
    "规则": {
      "status": "CATALOG_REPORTED_UNVERIFIED",
      "value": "本条只写源文件已印出的规则。选用交易所公布融资买入额（流量）作为资金维代表；对该序列做布林带策略：指标上穿上轨→买入；下穿下轨→卖出。页述相对北向停更后的杠杆资金日频替代。相对纯指数布林：本条为融资额通道核。 不是纯指数布林：本条为融资买入额流量布林带上穿上轨做多/下穿下轨做空核。 计入其他。 提出日期按源文件原样保留2025-05-29。"
    },
    "页码或文件": {
      "status": "CATALOG_REPORTED_UNVERIFIED",
      "value": "公开页/PDF已印出规则"
    }
  },
  "schema_version": "quantgraph-catalog-source-record/v1",
  "source_webpage_fulltext_fetched": false
}
