{
  "classification": {
    "entity_type": null,
    "evidence": [],
    "original_classification": null,
    "reason": "CSV_HAS_NO_AUTHORITATIVE_TYPE_COLUMN",
    "type_status": "UNREVIEWED"
  },
  "entity_type": "source_record",
  "execution_permission_granted": false,
  "identity_namespace": "grokbot",
  "knowledge_values_complete": true,
  "native_source_id": "M3046",
  "new_execution_trials": 0,
  "provenance": {
    "csv_row_ordinal": 3025,
    "csv_sha256": "15cc0ecbcb23261e3cd7f2fb0851815daed59951090d9ce3e759ef224ea6f415",
    "row_sha256": "1cd30204920e932b456e0d617a57ecc57aaf6e03ed8425c26f8525ee72e8890f",
    "rule_sha256": "85ac52fc1200bc7a5b661306e7286b60e2039b9e8a9a74bd7ceef185c9d8f557"
  },
  "publication": {
    "all_fields_reviewed": false,
    "reason_codes": [],
    "sensitive_fields": [],
    "status": "FIELD_REVIEW_REQUIRED"
  },
  "record_id": "M3046",
  "reported_fields": {
    "id": {
      "status": "CATALOG_REPORTED_UNVERIFIED",
      "value": "M3046"
    },
    "source_url": {
      "status": "CATALOG_REPORTED_UNVERIFIED",
      "value": "https://bigquant.com/square/b35ddcc3-7c2b-490f-8180-02d1456f9905"
    },
    "作者或机构": {
      "status": "CATALOG_REPORTED_UNVERIFIED",
      "value": "BigQuant策略社区（square《价值趋势选股策略》；bqpo6i；页更新约2026-09-09）"
    },
    "别名来源": {
      "status": "CATALOG_REPORTED_UNVERIFIED",
      "value": "无"
    },
    "可回测": {
      "status": "CATALOG_REPORTED_UNVERIFIED",
      "value": "高"
    },
    "名称": {
      "status": "CATALOG_REPORTED_UNVERIFIED",
      "value": "BigQuant社区：价值趋势选股（ROE/ROA预筛⊕市场趋势因子StockRanker；日持Top10）"
    },
    "市场": {
      "status": "CATALOG_REPORTED_UNVERIFIED",
      "value": "A股（日频；持仓10只）"
    },
    "提出日期": {
      "status": "CATALOG_REPORTED_UNVERIFIED",
      "value": "未知"
    },
    "标题": {
      "status": "CATALOG_REPORTED_UNVERIFIED",
      "value": "BigQuant社区：价值趋势选股（ROE/ROA预筛⊕市场趋势因子StockRanker；日持Top10）"
    },
    "规则": {
      "status": "CATALOG_REPORTED_UNVERIFIED",
      "value": "本条只写源文件已印出的规则。页印：先以ROE与ROA筛选符合设定标准的股票池，再以市场趋势因子为特征训练stock ranker，选择预测排名前十持有并每日调仓。页未印ROE/ROA具体数值阈值则不补造。相对已收盈利/营收增长小市值或纯StockRanker日10：本条为ROE·ROA双盈利预筛⊕趋势特征日Top10核。 计入其他。 提出日期按源文件原样保留未知。"
    },
    "页码或文件": {
      "status": "CATALOG_REPORTED_UNVERIFIED",
      "value": "公开页/PDF已印出规则"
    }
  },
  "schema_version": "quantgraph-catalog-source-record/v1",
  "source_webpage_fulltext_fetched": false
}
