{
  "classification": {
    "entity_type": null,
    "evidence": [],
    "original_classification": null,
    "reason": "CSV_HAS_NO_AUTHORITATIVE_TYPE_COLUMN",
    "type_status": "UNREVIEWED"
  },
  "entity_type": "source_record",
  "execution_permission_granted": false,
  "identity_namespace": "grokbot",
  "knowledge_values_complete": true,
  "native_source_id": "M3508",
  "new_execution_trials": 0,
  "provenance": {
    "csv_row_ordinal": 3462,
    "csv_sha256": "15cc0ecbcb23261e3cd7f2fb0851815daed59951090d9ce3e759ef224ea6f415",
    "row_sha256": "e3d7f582399ae2ae996a693de4ca05a3a341a59a2348726364ec9334aadd9c2b",
    "rule_sha256": "b189788a41011468dd137471e0d2eb6d16cb5fc5e372cf82d58e212cd6861a89"
  },
  "publication": {
    "all_fields_reviewed": false,
    "reason_codes": [],
    "sensitive_fields": [],
    "status": "FIELD_REVIEW_REQUIRED"
  },
  "record_id": "M3508",
  "reported_fields": {
    "id": {
      "status": "CATALOG_REPORTED_UNVERIFIED",
      "value": "M3508"
    },
    "source_url": {
      "status": "CATALOG_REPORTED_UNVERIFIED",
      "value": "https://quantpedia.com/active-dual-momentum-gtaa-strategy/"
    },
    "作者或机构": {
      "status": "CATALOG_REPORTED_UNVERIFIED",
      "value": "Sona Beluska / Quantpedia"
    },
    "别名来源": {
      "status": "CATALOG_REPORTED_UNVERIFIED",
      "value": "无"
    },
    "可回测": {
      "status": "CATALOG_REPORTED_UNVERIFIED",
      "value": "高"
    },
    "名称": {
      "status": "CATALOG_REPORTED_UNVERIFIED",
      "value": "美股/多资产ETF：周频周三收盘；宇宙SHY/IEF/UUP/GLD/USO/SPY/EFA/QQQ/EEM；50%仓为10周RoC正动量Top3等权，50%仓为25周RoC正动量Top3等权（Quantpedia Active Dual Momentum GTAA）"
    },
    "市场": {
      "status": "CATALOG_REPORTED_UNVERIFIED",
      "value": "美股/ETF（跨资产 ETF）"
    },
    "提出日期": {
      "status": "CATALOG_REPORTED_UNVERIFIED",
      "value": "2026-05-22"
    },
    "标题": {
      "status": "CATALOG_REPORTED_UNVERIFIED",
      "value": "美股/多资产ETF：周频周三收盘；宇宙SHY/IEF/UUP/GLD/USO/SPY/EFA/QQQ/EEM；50%仓为10周RoC正动量Top3等权，50%仓为25周RoC正动量Top3等权（Quantpedia Active Dual Momentum GTAA）"
    },
    "规则": {
      "status": "CATALOG_REPORTED_UNVERIFIED",
      "value": "本条只写 QuantPedia《Active Dual Momentum GTAA Strategy》最终合并策略。宇宙九只：**SHY、IEF、UUP、GLD、USO、SPY、EFA、QQQ、EEM**。动量=周频 Rate of Change；**绝对过滤**：RoC 须为正才可入选。子策略 A：按 **10** 周 RoC 取最高 **3** 只等权；子策略 B：按 **25** 周 RoC 取最高 **3** 只等权；最终组合对 A/B 各配 **50%**，**每周三收盘**再平衡。不是无绝对过滤的纯相对动量，也不是 Antonacci 股票/债券双资产 GEM。提出日期取文头 **22.May 2026**。Quantpedia Active Dual Momentum GTAA：九ETF宇宙；10周与25周正RoC Top3各50%、周三再平衡 ≠ Antonacci GEM双资产/无绝对过滤纯相对动量。计入美股/ETF。提出日期按源文件原样保留2026-05-22。"
    },
    "页码或文件": {
      "status": "CATALOG_REPORTED_UNVERIFIED",
      "value": "Methodology（宇宙+绝对 RoC>0）+ Ultimately we chose… Final strategy（10-week / 25-week × Top3 × 50/50；Wednesday）"
    }
  },
  "schema_version": "quantgraph-catalog-source-record/v1",
  "source_webpage_fulltext_fetched": false
}
