{
  "classification": {
    "entity_type": null,
    "evidence": [],
    "original_classification": null,
    "reason": "CSV_HAS_NO_AUTHORITATIVE_TYPE_COLUMN",
    "type_status": "UNREVIEWED"
  },
  "entity_type": "source_record",
  "execution_permission_granted": false,
  "identity_namespace": "grokbot",
  "knowledge_values_complete": true,
  "native_source_id": "M6680",
  "new_execution_trials": 0,
  "provenance": {
    "csv_row_ordinal": 6634,
    "csv_sha256": "15cc0ecbcb23261e3cd7f2fb0851815daed59951090d9ce3e759ef224ea6f415",
    "row_sha256": "b02ca8f565760103fd5f7749eb60ab655cdfc3e0880d069de073fefd6974f632",
    "rule_sha256": "61af3c91c77a63ccc39718d22b999339d832316b46b743b1283b7a847507be0f"
  },
  "publication": {
    "all_fields_reviewed": false,
    "reason_codes": [],
    "sensitive_fields": [],
    "status": "FIELD_REVIEW_REQUIRED"
  },
  "record_id": "M6680",
  "reported_fields": {
    "id": {
      "status": "CATALOG_REPORTED_UNVERIFIED",
      "value": "M6680"
    },
    "source_url": {
      "status": "CATALOG_REPORTED_UNVERIFIED",
      "value": "https://finance.yahoo.com/quote/GSSC/"
    },
    "作者或机构": {
      "status": "CATALOG_REPORTED_UNVERIFIED",
      "value": "Goldman Sachs Asset Management"
    },
    "别名来源": {
      "status": "CATALOG_REPORTED_UNVERIFIED",
      "value": "quant-web-harvest-379/W3891"
    },
    "可回测": {
      "status": "CATALOG_REPORTED_UNVERIFIED",
      "value": "高"
    },
    "名称": {
      "status": "CATALOG_REPORTED_UNVERIFIED",
      "value": "Goldman·美股小盘ActiveBeta GSSC：价值+动量+质量+低波动多因子持有（GSSC·GS·ActiveBetaUSSmall）"
    },
    "市场": {
      "status": "CATALOG_REPORTED_UNVERIFIED",
      "value": "美股/ETF"
    },
    "提出日期": {
      "status": "CATALOG_REPORTED_UNVERIFIED",
      "value": "2017-07-10"
    },
    "标题": {
      "status": "CATALOG_REPORTED_UNVERIFIED",
      "value": "Goldman Sachs ActiveBeta U.S. Small Cap Equity ETF (GSSC)"
    },
    "规则": {
      "status": "CATALOG_REPORTED_UNVERIFIED",
      "value": "本条只写 Goldman Sachs ActiveBeta U.S. Small Cap Equity ETF（GSSC）/ Goldman Sachs ActiveBeta U.S. Small Cap Equity Index 公开方法论持有核。宇宙≈Russell 2000美股小盘；等权混合价值、动量、质量与低波动四因子分指数后合成；季度再平衡并含换手最小化。不是GSLC美股大盘ActiveBeta（近M3831）；不是GSIE国际ActiveBeta（近M6673）；不是VFMF…GLOF/EQAL/PSC/FLRG/ROAM/TILT/QEFA/QEMM/QGRO/AVEM/AVSC（近M6457–M6671）；不是SMA200闸。可用GSSC作Yahoo代理。"
    },
    "页码或文件": {
      "status": "CATALOG_REPORTED_UNVERIFIED",
      "value": "GSSC·GS·ActiveBetaUSSmall"
    }
  },
  "schema_version": "quantgraph-catalog-source-record/v1",
  "source_webpage_fulltext_fetched": false
}
