{
  "classification": {
    "entity_type": null,
    "evidence": [],
    "original_classification": null,
    "reason": "CSV_HAS_NO_AUTHORITATIVE_TYPE_COLUMN",
    "type_status": "UNREVIEWED"
  },
  "entity_type": "source_record",
  "execution_permission_granted": false,
  "identity_namespace": "grokbot",
  "knowledge_values_complete": true,
  "native_source_id": "M0857",
  "new_execution_trials": 0,
  "provenance": {
    "csv_row_ordinal": 857,
    "csv_sha256": "15cc0ecbcb23261e3cd7f2fb0851815daed59951090d9ce3e759ef224ea6f415",
    "row_sha256": "3f7280a0f79018ddb49158dbeae041f5a98dc27d6874796062ce1d39c174eba6",
    "rule_sha256": "e24641359c5cad0b69110144a13ccd44ffc3e230f376535b54d70cd93fc20231"
  },
  "publication": {
    "all_fields_reviewed": false,
    "reason_codes": [],
    "sensitive_fields": [],
    "status": "FIELD_REVIEW_REQUIRED"
  },
  "record_id": "M0857",
  "reported_fields": {
    "id": {
      "status": "CATALOG_REPORTED_UNVERIFIED",
      "value": "M0857"
    },
    "source_url": {
      "status": "CATALOG_REPORTED_UNVERIFIED",
      "value": "https://www.quantconnect.com/strategies/149/USDJPY-Tokyo-Open-Range-Breakout"
    },
    "作者或机构": {
      "status": "CATALOG_REPORTED_UNVERIFIED",
      "value": "Kenneth Wong"
    },
    "别名来源": {
      "status": "CATALOG_REPORTED_UNVERIFIED",
      "value": "无"
    },
    "可回测": {
      "status": "CATALOG_REPORTED_UNVERIFIED",
      "value": "高"
    },
    "名称": {
      "status": "CATALOG_REPORTED_UNVERIFIED",
      "value": "美元日元东京开盘区间突破：01:00第一根小时线，突破高点做多、跌破低点做空，100%多或100%空，13:00至次日01:00空仓"
    },
    "市场": {
      "status": "CATALOG_REPORTED_UNVERIFIED",
      "value": "外汇"
    },
    "提出日期": {
      "status": "CATALOG_REPORTED_UNVERIFIED",
      "value": "2019-09-09"
    },
    "标题": {
      "status": "CATALOG_REPORTED_UNVERIFIED",
      "value": "USDJPY Tokyo Open Range Breakout"
    },
    "规则": {
      "status": "CATALOG_REPORTED_UNVERIFIED",
      "value": "本条计入其他，不是加密，也不是美股。不是已收的四个G10货币对30日偏度低于-0.6做多、高于+0.6做空。也不是TQQQ首根5分钟开盘区间，也不是MNQ的09:30至09:45开盘区间，也不是活跃股5分钟开盘区间。主文件没有已印出这组时点的USDJPY东京开盘区间。每个交易日以平台时间凌晨1点的第一根小时线定义参考区间；在东京开盘后的后续亚洲至上午窗口，价格突破该小时线高点做多、跌破低点做空，持有完整名义仓位（100%多或100%空）。使用小时FX数据，13:00至次日01:00保持空仓，并在每日截止时间强制平仓；不使用止损/止盈，主要以严格的时间退出和单一品种限制风险。提出日期按页面原样保留2019-09-09。"
    },
    "页码或文件": {
      "status": "CATALOG_REPORTED_UNVERIFIED",
      "value": "公开策略详情页"
    }
  },
  "schema_version": "quantgraph-catalog-source-record/v1",
  "source_webpage_fulltext_fetched": false
}
