{
  "classification": {
    "entity_type": null,
    "evidence": [],
    "original_classification": null,
    "reason": "CSV_HAS_NO_AUTHORITATIVE_TYPE_COLUMN",
    "type_status": "UNREVIEWED"
  },
  "entity_type": "source_record",
  "execution_permission_granted": false,
  "identity_namespace": "grokbot",
  "knowledge_values_complete": true,
  "native_source_id": "M4955",
  "new_execution_trials": 0,
  "provenance": {
    "csv_row_ordinal": 4909,
    "csv_sha256": "15cc0ecbcb23261e3cd7f2fb0851815daed59951090d9ce3e759ef224ea6f415",
    "row_sha256": "3c01ea2c6b0c4d5fac056784d086698a0a04083befd0915668401bd07d389625",
    "rule_sha256": "4acc137ef69ca8269a7b6fb9137a429b1682713e1a579c4b11467a28834c7a5d"
  },
  "publication": {
    "all_fields_reviewed": false,
    "reason_codes": [],
    "sensitive_fields": [],
    "status": "FIELD_REVIEW_REQUIRED"
  },
  "record_id": "M4955",
  "reported_fields": {
    "id": {
      "status": "CATALOG_REPORTED_UNVERIFIED",
      "value": "M4955"
    },
    "source_url": {
      "status": "CATALOG_REPORTED_UNVERIFIED",
      "value": "https://www.naaim.org/wp-content/uploads/2013/10/00D_Absolute-Momentum_gary_antonacci.pdf"
    },
    "作者或机构": {
      "status": "CATALOG_REPORTED_UNVERIFIED",
      "value": "Gary Antonacci"
    },
    "别名来源": {
      "status": "CATALOG_REPORTED_UNVERIFIED",
      "value": "quant-web-harvest-206/W2166"
    },
    "可回测": {
      "status": "CATALOG_REPORTED_UNVERIFIED",
      "value": "高"
    },
    "名称": {
      "status": "CATALOG_REPORTED_UNVERIFIED",
      "value": "Antonacci·绝对动量仅SPY：月末；SPY过去12月收益>BIL则满仓SPY，否则满仓BIL（AbsMom·SPY/BIL·12）"
    },
    "市场": {
      "status": "CATALOG_REPORTED_UNVERIFIED",
      "value": "美股/ETF"
    },
    "提出日期": {
      "status": "CATALOG_REPORTED_UNVERIFIED",
      "value": "2013-02-28"
    },
    "标题": {
      "status": "CATALOG_REPORTED_UNVERIFIED",
      "value": "Absolute Momentum: A Simple Rule-Based Strategy"
    },
    "规则": {
      "status": "CATALOG_REPORTED_UNVERIFIED",
      "value": "本条只写 Gary Antonacci 绝对动量在 **单一美股代理** 上的可钉核（NAAIM Absolute Momentum 方法口径）：每月末比较 **SPY** 与 **BIL** 过去 **12** 月总分收益；SPY **>** BIL 则满仓 **SPY**，否则满仓 **BIL**。不是五资产平价袖各做绝对动量（M0746）；不是 CXO AbsMom·VT/AGG（M4929）；不是完整 GEM 相对+绝对（M0069）。**OVERRIDE** 同 URL 异核。计入美股/ETF。提出日期 2013-02-28。"
    },
    "页码或文件": {
      "status": "CATALOG_REPORTED_UNVERIFIED",
      "value": "NAAIM 2013 · AbsMom · SPY vs BIL · 12m · single-asset"
    }
  },
  "schema_version": "quantgraph-catalog-source-record/v1",
  "source_webpage_fulltext_fetched": false
}
