{
  "classification": {
    "entity_type": null,
    "evidence": [],
    "original_classification": null,
    "reason": "CSV_HAS_NO_AUTHORITATIVE_TYPE_COLUMN",
    "type_status": "UNREVIEWED"
  },
  "entity_type": "source_record",
  "execution_permission_granted": false,
  "identity_namespace": "grokbot",
  "knowledge_values_complete": true,
  "native_source_id": "M0073",
  "new_execution_trials": 0,
  "provenance": {
    "csv_row_ordinal": 73,
    "csv_sha256": "15cc0ecbcb23261e3cd7f2fb0851815daed59951090d9ce3e759ef224ea6f415",
    "row_sha256": "7f13ac9d57c602eebfe4fbaec72e6fd910a5c6ee3fe443121707ba84d760b765",
    "rule_sha256": "d047929b7c2cdd00439258e1fcfae82a23e82929693caa5b0d124c17ae4caaaa"
  },
  "publication": {
    "all_fields_reviewed": false,
    "reason_codes": [],
    "sensitive_fields": [],
    "status": "FIELD_REVIEW_REQUIRED"
  },
  "record_id": "M0073",
  "reported_fields": {
    "id": {
      "status": "CATALOG_REPORTED_UNVERIFIED",
      "value": "M0073"
    },
    "source_url": {
      "status": "CATALOG_REPORTED_UNVERIFIED",
      "value": "https://github.com/paperswithbacktest/awesome-systematic-trading/blob/main/static/strategies/momentum-factor-combined-with-asset-growth-effect.py"
    },
    "作者或机构": {
      "status": "CATALOG_REPORTED_UNVERIFIED",
      "value": "paperswithbacktest"
    },
    "别名来源": {
      "status": "CATALOG_REPORTED_UNVERIFIED",
      "value": "https://github.com/paperswithbacktest/awesome-systematic-trading/blob/main/static/strategies/asset-growth-effect.py（awe:asset-growth-effect） ； https://www.quantconnect.com/docs/v2/writing-algorithms/strategy-library（zh:A26） ； https://github.com/QuantConnect/Tutorials"
    },
    "可回测": {
      "status": "CATALOG_REPORTED_UNVERIFIED",
      "value": "高"
    },
    "名称": {
      "status": "CATALOG_REPORTED_UNVERIFIED",
      "value": "动量叠加资产增长"
    },
    "市场": {
      "status": "CATALOG_REPORTED_UNVERIFIED",
      "value": "美股"
    },
    "提出日期": {
      "status": "CATALOG_REPORTED_UNVERIFIED",
      "value": "未知"
    },
    "标题": {
      "status": "CATALOG_REPORTED_UNVERIFIED",
      "value": "动量叠加资产增长"
    },
    "规则": {
      "status": "CATALOG_REPORTED_UNVERIFIED",
      "value": "投资范围为NYSE/AMEX/NASDAQ且市值不低于NYSE第20百分位的股票（该实现为流动性最好的500只）；每年用t-2到t-1总资产变化，每月只保留资产增长最高十分位，再按跳过最近一个月的过去11个月收益分成五等份，做多动量最强、做空最弱，等权每月再平衡，且仅在2月至12月持有。"
    },
    "页码或文件": {
      "status": "CATALOG_REPORTED_UNVERIFIED",
      "value": "momentum-factor-combined-with-asset-growth-effect.py"
    }
  },
  "schema_version": "quantgraph-catalog-source-record/v1",
  "source_webpage_fulltext_fetched": false
}
