{
  "classification": {
    "entity_type": null,
    "evidence": [],
    "original_classification": null,
    "reason": "CSV_HAS_NO_AUTHORITATIVE_TYPE_COLUMN",
    "type_status": "UNREVIEWED"
  },
  "entity_type": "source_record",
  "execution_permission_granted": false,
  "identity_namespace": "grokbot",
  "knowledge_values_complete": true,
  "native_source_id": "M6389",
  "new_execution_trials": 0,
  "provenance": {
    "csv_row_ordinal": 6343,
    "csv_sha256": "15cc0ecbcb23261e3cd7f2fb0851815daed59951090d9ce3e759ef224ea6f415",
    "row_sha256": "8af84ce9a03372605cc3cdd4f5fd204f802c52c6008dcd6906203bc67df31fc8",
    "rule_sha256": "9b98a05a988f7f213fb8a1ce471be57bccb9b83eb74154271489bb59edd2a29d"
  },
  "publication": {
    "all_fields_reviewed": false,
    "reason_codes": [],
    "sensitive_fields": [],
    "status": "FIELD_REVIEW_REQUIRED"
  },
  "record_id": "M6389",
  "reported_fields": {
    "id": {
      "status": "CATALOG_REPORTED_UNVERIFIED",
      "value": "M6389"
    },
    "source_url": {
      "status": "CATALOG_REPORTED_UNVERIFIED",
      "value": "https://www.cxoadvisory.com/momentum-investing/a-few-notes-on-dual-momentum-investing/"
    },
    "作者或机构": {
      "status": "CATALOG_REPORTED_UNVERIFIED",
      "value": "CXO Advisory"
    },
    "别名来源": {
      "status": "CATALOG_REPORTED_UNVERIFIED",
      "value": "quant-web-harvest-349/W3600"
    },
    "可回测": {
      "status": "CATALOG_REPORTED_UNVERIFIED",
      "value": "高"
    },
    "名称": {
      "status": "CATALOG_REPORTED_UNVERIFIED",
      "value": "CXO·社媒相对短债十二月：月末；SOCL与SHY过去12月总分收益较高者满仓（RelMom·SOCL/SHY·12）"
    },
    "市场": {
      "status": "CATALOG_REPORTED_UNVERIFIED",
      "value": "美股/ETF"
    },
    "提出日期": {
      "status": "CATALOG_REPORTED_UNVERIFIED",
      "value": "2015-01-01"
    },
    "标题": {
      "status": "CATALOG_REPORTED_UNVERIFIED",
      "value": "Relative Momentum SOCL vs SHY — 12m"
    },
    "规则": {
      "status": "CATALOG_REPORTED_UNVERIFIED",
      "value": "本条只写 CXO 相对动量框架之 **社交媒体ETF vs 短债 新标对** 可钉核。月末：比较 SOCL 与 SHY 过去 **12个月总分收益**，满仓较高者。不是 XRT/XHB/XME/XLRE/XLC/XLY/XLB/XLV/XLP/XLU/XLI/XLF/XLE/XLK/IYT/XBI/SMH/SOXX/IBB/KRE/ITA/XAR/IGV/OIH/JETS/XOP/XSD/XPH/XHE/XTN/KBE/KIE/IHI/IHF/CIBR/SKYY/FINX/PAVE/URA/REMX/SHY；不是 AbsMom·SOCL；不是 AbsMom·BOTZ；不是 SOCL 产品页非动量条；不是 RelMom·XLC（通信服务同主题异标）。计入美股/ETF。提出日期 2015-01-01。"
    },
    "页码或文件": {
      "status": "CATALOG_REPORTED_UNVERIFIED",
      "value": "RelMom·SOCL/SHY·12"
    }
  },
  "schema_version": "quantgraph-catalog-source-record/v1",
  "source_webpage_fulltext_fetched": false
}
