{
  "classification": {
    "entity_type": null,
    "evidence": [],
    "original_classification": null,
    "reason": "CSV_HAS_NO_AUTHORITATIVE_TYPE_COLUMN",
    "type_status": "UNREVIEWED"
  },
  "entity_type": "source_record",
  "execution_permission_granted": false,
  "identity_namespace": "grokbot",
  "knowledge_values_complete": true,
  "native_source_id": "M3953",
  "new_execution_trials": 0,
  "provenance": {
    "csv_row_ordinal": 3907,
    "csv_sha256": "15cc0ecbcb23261e3cd7f2fb0851815daed59951090d9ce3e759ef224ea6f415",
    "row_sha256": "fa0a2f2a361a8e1b04ff5fa4be33d2292dece6ab1bd8abcb777135bccc100dce",
    "rule_sha256": "d31a1f01cbde585ea5ee8deee787b0a074e74a70e957d9caa64c67342cfaa328"
  },
  "publication": {
    "all_fields_reviewed": false,
    "reason_codes": [],
    "sensitive_fields": [],
    "status": "FIELD_REVIEW_REQUIRED"
  },
  "record_id": "M3953",
  "reported_fields": {
    "id": {
      "status": "CATALOG_REPORTED_UNVERIFIED",
      "value": "M3953"
    },
    "source_url": {
      "status": "CATALOG_REPORTED_UNVERIFIED",
      "value": "https://www.quantconnect.com/research/20983/"
    },
    "作者或机构": {
      "status": "CATALOG_REPORTED_UNVERIFIED",
      "value": "QuantConnect 社区"
    },
    "别名来源": {
      "status": "CATALOG_REPORTED_UNVERIFIED",
      "value": "quant-web-harvest-100/W1160"
    },
    "可回测": {
      "status": "CATALOG_REPORTED_UNVERIFIED",
      "value": "高"
    },
    "名称": {
      "status": "CATALOG_REPORTED_UNVERIFIED",
      "value": "QC·大盘风险调整12-1动量十分位：日频；市值>$100亿的流动性Top500；12月剔近21日收益÷60日波动，等权持最强十分位（QC RiskAdjMom·12-1/60vol·Decile）"
    },
    "市场": {
      "status": "CATALOG_REPORTED_UNVERIFIED",
      "value": "美股/ETF"
    },
    "提出日期": {
      "status": "CATALOG_REPORTED_UNVERIFIED",
      "value": "未知"
    },
    "标题": {
      "status": "CATALOG_REPORTED_UNVERIFIED",
      "value": "QC·大盘风险调整12-1动量十分位：日频；市值>$100亿的流动性Top500；12月剔近21日收益÷60日波动，等权持最强十分位（QC RiskAdjMom·12-1/60vol·Decile）"
    },
    "规则": {
      "status": "CATALOG_REPORTED_UNVERIFIED",
      "value": "本条只写 QuantConnect《Strategy Discussion: 576》：宇宙为市值 **>$100亿** 且流动性靠前的约 **500** 只；得分=（近 **12** 月收益**剔除最近 21** 日）/近 **60** 日实现波动；每日开盘后等权持有得分最高**十分位**，跌出十分位则清仓；约 **253** 日预热。不是标普500内 12-1/252 波 Top50 月频（M3621）；不是无波动缩放的 12-1。计入美股/ETF。提出日期未知，不编造。"
    },
    "页码或文件": {
      "status": "CATALOG_REPORTED_UNVERIFIED",
      "value": "Research 20983 12-1/60vol top-decile daily"
    }
  },
  "schema_version": "quantgraph-catalog-source-record/v1",
  "source_webpage_fulltext_fetched": false
}
