{
  "classification": {
    "entity_type": null,
    "evidence": [],
    "original_classification": null,
    "reason": "CSV_HAS_NO_AUTHORITATIVE_TYPE_COLUMN",
    "type_status": "UNREVIEWED"
  },
  "entity_type": "source_record",
  "execution_permission_granted": false,
  "identity_namespace": "grokbot",
  "knowledge_values_complete": true,
  "native_source_id": "M6783",
  "new_execution_trials": 0,
  "provenance": {
    "csv_row_ordinal": 6737,
    "csv_sha256": "15cc0ecbcb23261e3cd7f2fb0851815daed59951090d9ce3e759ef224ea6f415",
    "row_sha256": "2284c8776fdbfd6b8b2bbb8eda57ab6b15f785a6703e3e616d93c83ca4bbd1d2",
    "rule_sha256": "5fce300f974ffa7f8237245133263da4d08e3ae139ce8f1b65a4c1b8f21b35ee"
  },
  "publication": {
    "all_fields_reviewed": false,
    "reason_codes": [],
    "sensitive_fields": [],
    "status": "FIELD_REVIEW_REQUIRED"
  },
  "record_id": "M6783",
  "reported_fields": {
    "id": {
      "status": "CATALOG_REPORTED_UNVERIFIED",
      "value": "M6783"
    },
    "source_url": {
      "status": "CATALOG_REPORTED_UNVERIFIED",
      "value": "https://github.com/OpenSourceAP/CrossSection/blob/master/Signals/pyCode/Predictors/BetaTailRisk.py"
    },
    "作者或机构": {
      "status": "CATALOG_REPORTED_UNVERIFIED",
      "value": "Kelly and Jiang / OpenSourceAP CrossSection"
    },
    "别名来源": {
      "status": "CATALOG_REPORTED_UNVERIFIED",
      "value": "quant-web-harvest-389/W3994"
    },
    "可回测": {
      "status": "CATALOG_REPORTED_UNVERIFIED",
      "value": "高"
    },
    "名称": {
      "status": "CATALOG_REPORTED_UNVERIFIED",
      "value": "Kelly·尾部风险β五分位多空：年12月末；BetaTailRisk=120月尾部风险因子β；|价|>5；等权多最高空最低持12月（Kelly·BetaTailRisk·QuintileL/S）"
    },
    "市场": {
      "status": "CATALOG_REPORTED_UNVERIFIED",
      "value": "美股/ETF"
    },
    "提出日期": {
      "status": "CATALOG_REPORTED_UNVERIFIED",
      "value": "2014-01-01"
    },
    "标题": {
      "status": "CATALOG_REPORTED_UNVERIFIED",
      "value": "Tail risk beta (BetaTailRisk) quintile long-short"
    },
    "规则": {
      "status": "CATALOG_REPORTED_UNVERIFIED",
      "value": "本条只写 OpenSourceAP/CrossSection 可执行核 Kelly and Jiang (2014) BetaTailRisk。年12月末：由全市场日收益5%分位构造月度尾部风险因子，个股对该因子做120月滚动回归（最少72月）得BetaTailRisk；滤|prc|>5且普通股；等权五分位做多最高BetaTailRisk、做空最低，持12月。Sign=+1。不是目录核M0379（仅Signal Browser定义）；不是betaVIX/RealizedVol近核；不是SMA200闸。"
    },
    "页码或文件": {
      "status": "CATALOG_REPORTED_UNVERIFIED",
      "value": "Kelly·BetaTailRisk·QuintileL/S"
    }
  },
  "schema_version": "quantgraph-catalog-source-record/v1",
  "source_webpage_fulltext_fetched": false
}
