{
  "classification": {
    "entity_type": null,
    "evidence": [],
    "original_classification": null,
    "reason": "CSV_HAS_NO_AUTHORITATIVE_TYPE_COLUMN",
    "type_status": "UNREVIEWED"
  },
  "entity_type": "source_record",
  "execution_permission_granted": false,
  "identity_namespace": "grokbot",
  "knowledge_values_complete": true,
  "native_source_id": "M6669",
  "new_execution_trials": 0,
  "provenance": {
    "csv_row_ordinal": 6623,
    "csv_sha256": "15cc0ecbcb23261e3cd7f2fb0851815daed59951090d9ce3e759ef224ea6f415",
    "row_sha256": "8fa3c1a8a9dced3f0eee404067f915c42296d47f00bc5225cb7a76b5f3a00075",
    "rule_sha256": "b11f707ff65c1ad9b872a652e839bebc059bf6975f61118bcaec0192d278f189"
  },
  "publication": {
    "all_fields_reviewed": false,
    "reason_codes": [],
    "sensitive_fields": [],
    "status": "FIELD_REVIEW_REQUIRED"
  },
  "record_id": "M6669",
  "reported_fields": {
    "id": {
      "status": "CATALOG_REPORTED_UNVERIFIED",
      "value": "M6669"
    },
    "source_url": {
      "status": "CATALOG_REPORTED_UNVERIFIED",
      "value": "https://github.com/OpenSourceAP/CrossSection/blob/master/Signals/pyCode/Predictors/SurpriseRD.py"
    },
    "作者或机构": {
      "status": "CATALOG_REPORTED_UNVERIFIED",
      "value": "Eberhart, Maxwell and Siddique / OpenSourceAP CrossSection"
    },
    "别名来源": {
      "status": "CATALOG_REPORTED_UNVERIFIED",
      "value": "quant-web-harvest-377/W3880"
    },
    "可回测": {
      "status": "CATALOG_REPORTED_UNVERIFIED",
      "value": "高"
    },
    "名称": {
      "status": "CATALOG_REPORTED_UNVERIFIED",
      "value": "Eberhart·意外研发增加多空：月末；R&D同比与强度双超5%等条件；等权多SurpriseRD=1空=0持1月（Eberhart·SurpriseRD·BinaryL/S）"
    },
    "市场": {
      "status": "CATALOG_REPORTED_UNVERIFIED",
      "value": "美股/ETF"
    },
    "提出日期": {
      "status": "CATALOG_REPORTED_UNVERIFIED",
      "value": "2004-01-01"
    },
    "标题": {
      "status": "CATALOG_REPORTED_UNVERIFIED",
      "value": "Unexpected R&D increase (SurpriseRD) binary long-short"
    },
    "规则": {
      "status": "CATALOG_REPORTED_UNVERIFIED",
      "value": "本条只写 OpenSourceAP/CrossSection 可执行核 Eberhart, Maxwell and Siddique (2004) SurpriseRD。月末：若 xrd/revt>0、xrd/at>0、xrd同比>1.05 且 (xrd/at)相对滞后同比>1.05 且当期与滞后xrd非缺失，则SurpriseRD=1，否则在xrd可得时为0；等权做多SurpriseRD=1、做空=0，持1月。Sign=+1。不是PatentsRD/RDS/RDAbility近核；不是ChInv（近M6618）；可直接跑 SurpriseRD.py。"
    },
    "页码或文件": {
      "status": "CATALOG_REPORTED_UNVERIFIED",
      "value": "Eberhart·SurpriseRD·BinaryL/S"
    }
  },
  "schema_version": "quantgraph-catalog-source-record/v1",
  "source_webpage_fulltext_fetched": false
}
