{
  "classification": {
    "entity_type": null,
    "evidence": [],
    "original_classification": null,
    "reason": "CSV_HAS_NO_AUTHORITATIVE_TYPE_COLUMN",
    "type_status": "UNREVIEWED"
  },
  "entity_type": "source_record",
  "execution_permission_granted": false,
  "identity_namespace": "grokbot",
  "knowledge_values_complete": true,
  "native_source_id": "M3940",
  "new_execution_trials": 0,
  "provenance": {
    "csv_row_ordinal": 3894,
    "csv_sha256": "15cc0ecbcb23261e3cd7f2fb0851815daed59951090d9ce3e759ef224ea6f415",
    "row_sha256": "d554caf275fca776978fd7f2966c775e2b90f3471dabfe56ed4e255ef72ccc3e",
    "rule_sha256": "9d9c74927a82296cfd393d5aae4ff2c17a75a40803108bcaf81392d2027d5394"
  },
  "publication": {
    "all_fields_reviewed": false,
    "reason_codes": [],
    "sensitive_fields": [],
    "status": "FIELD_REVIEW_REQUIRED"
  },
  "record_id": "M3940",
  "reported_fields": {
    "id": {
      "status": "CATALOG_REPORTED_UNVERIFIED",
      "value": "M3940"
    },
    "source_url": {
      "status": "CATALOG_REPORTED_UNVERIFIED",
      "value": "https://www.quantconnect.com/research/18544/"
    },
    "作者或机构": {
      "status": "CATALOG_REPORTED_UNVERIFIED",
      "value": "QuantConnect 社区"
    },
    "别名来源": {
      "status": "CATALOG_REPORTED_UNVERIFIED",
      "value": "quant-web-harvest-98/W1147"
    },
    "可回测": {
      "status": "CATALOG_REPORTED_UNVERIFIED",
      "value": "中"
    },
    "名称": {
      "status": "CATALOG_REPORTED_UNVERIFIED",
      "value": "QC·QQQ·VWMA-ROC动量：分钟聚日；27日VWMA的6日ROC越±0.2%开仓，仓位约40%（QC QQQ·VWMA27·ROC6·0.2%）"
    },
    "市场": {
      "status": "CATALOG_REPORTED_UNVERIFIED",
      "value": "美股/ETF"
    },
    "提出日期": {
      "status": "CATALOG_REPORTED_UNVERIFIED",
      "value": "未知"
    },
    "标题": {
      "status": "CATALOG_REPORTED_UNVERIFIED",
      "value": "QC·QQQ·VWMA-ROC动量：分钟聚日；27日VWMA的6日ROC越±0.2%开仓，仓位约40%（QC QQQ·VWMA27·ROC6·0.2%）"
    },
    "规则": {
      "status": "CATALOG_REPORTED_UNVERIFIED",
      "value": "本条只写 QuantConnect《VWMA-ROC Momentum》：标的 **QQQ**（分钟数据聚日）；用近 **27** 日（不含当日）分钟量价算日 **VWMA**；再算该 VWMA 的 **6** 日 ROC；当 ROC **超过 ±0.2%** 才按方向开仓，目标仓位约组合 **40%**。不是 QQQ 小时 VWMA/HMA 做空（近 M1210）；不是会话 VWAP 翻仓（本批 W1145）。计入美股/ETF。提出日期未知，不编造。"
    },
    "页码或文件": {
      "status": "CATALOG_REPORTED_UNVERIFIED",
      "value": "Research 18544 QQQ VWMA27 ROC6 0.2%"
    }
  },
  "schema_version": "quantgraph-catalog-source-record/v1",
  "source_webpage_fulltext_fetched": false
}
