{
  "classification": {
    "entity_type": null,
    "evidence": [],
    "original_classification": null,
    "reason": "CSV_HAS_NO_AUTHORITATIVE_TYPE_COLUMN",
    "type_status": "UNREVIEWED"
  },
  "entity_type": "source_record",
  "execution_permission_granted": false,
  "identity_namespace": "grokbot",
  "knowledge_values_complete": true,
  "native_source_id": "M1749",
  "new_execution_trials": 0,
  "provenance": {
    "csv_row_ordinal": 1749,
    "csv_sha256": "15cc0ecbcb23261e3cd7f2fb0851815daed59951090d9ce3e759ef224ea6f415",
    "row_sha256": "3d68391ceaf7a5dac6e73a30bfbe0e9d3eb5a10a1c2d6ea96047495659be441e",
    "rule_sha256": "ab1634f7aa1906dd0573c6baba887f5051fdad5cf9b4eded1e9cf29418d87094"
  },
  "publication": {
    "all_fields_reviewed": false,
    "reason_codes": [],
    "sensitive_fields": [],
    "status": "FIELD_REVIEW_REQUIRED"
  },
  "record_id": "M1749",
  "reported_fields": {
    "id": {
      "status": "CATALOG_REPORTED_UNVERIFIED",
      "value": "M1749"
    },
    "source_url": {
      "status": "CATALOG_REPORTED_UNVERIFIED",
      "value": "https://file.iyanbao.com/pdf/034a0-f62a88b5-eb5e-4618-86cc-fdb816341902.pdf"
    },
    "作者或机构": {
      "status": "CATALOG_REPORTED_UNVERIFIED",
      "value": "东吴证券金工（高子剑、凌志杰；研报PDF《换手率变化率的稳定GTR选股因子绩效月报》附录；专题2023-05-16）"
    },
    "别名来源": {
      "status": "CATALOG_REPORTED_UNVERIFIED",
      "value": "无"
    },
    "可回测": {
      "status": "CATALOG_REPORTED_UNVERIFIED",
      "value": "高"
    },
    "名称": {
      "status": "CATALOG_REPORTED_UNVERIFIED",
      "value": "东吴金工纯净GTR（GTR对31个申万一级行业虚拟变量回归残差）"
    },
    "市场": {
      "status": "CATALOG_REPORTED_UNVERIFIED",
      "value": "A股（全体A股叙述；月频）"
    },
    "提出日期": {
      "status": "CATALOG_REPORTED_UNVERIFIED",
      "value": "2023-05-16"
    },
    "标题": {
      "status": "CATALOG_REPORTED_UNVERIFIED",
      "value": "东吴金工纯净GTR（GTR对31个申万一级行业虚拟变量回归残差）"
    },
    "规则": {
      "status": "CATALOG_REPORTED_UNVERIFIED",
      "value": "本条只写源文件已印出的规则。每月月底将GTR对31个申万一级行业虚拟变量回归，取残差为纯净GTR。页述GTR与Barra风格相关绝对值最高不超过约0.02，仍剔除行业干扰。相对GTR原式：本条为行业净化残差（页印31个申万一级）。 不是GTR原式：本条为GTR对31个申万一级行业虚拟变量回归残差的纯净GTR。 计入其他。 提出日期按源文件原样保留2023-05-16。"
    },
    "页码或文件": {
      "status": "CATALOG_REPORTED_UNVERIFIED",
      "value": "公开页/PDF已印出规则"
    }
  },
  "schema_version": "quantgraph-catalog-source-record/v1",
  "source_webpage_fulltext_fetched": false
}
