{
  "classification": {
    "entity_type": null,
    "evidence": [],
    "original_classification": null,
    "reason": "CSV_HAS_NO_AUTHORITATIVE_TYPE_COLUMN",
    "type_status": "UNREVIEWED"
  },
  "entity_type": "source_record",
  "execution_permission_granted": false,
  "identity_namespace": "grokbot",
  "knowledge_values_complete": true,
  "native_source_id": "M5559",
  "new_execution_trials": 0,
  "provenance": {
    "csv_row_ordinal": 5513,
    "csv_sha256": "15cc0ecbcb23261e3cd7f2fb0851815daed59951090d9ce3e759ef224ea6f415",
    "row_sha256": "b9ce38ab3e8c1c0c0a315f04d3a638e841627c5b9c5e2639f375904382c6c0fb",
    "rule_sha256": "d24e6559053a54291da1e66cc1e9997d2b4847cddee01740aef17b5a596152f6"
  },
  "publication": {
    "all_fields_reviewed": false,
    "reason_codes": [],
    "sensitive_fields": [],
    "status": "FIELD_REVIEW_REQUIRED"
  },
  "record_id": "M5559",
  "reported_fields": {
    "id": {
      "status": "CATALOG_REPORTED_UNVERIFIED",
      "value": "M5559"
    },
    "source_url": {
      "status": "CATALOG_REPORTED_UNVERIFIED",
      "value": "https://www.fidelity.com/learning-center/trading-investing/technical-analysis/technical-indicator-guide/swing-index"
    },
    "作者或机构": {
      "status": "CATALOG_REPORTED_UNVERIFIED",
      "value": "Welles Wilder / Fidelity"
    },
    "别名来源": {
      "status": "CATALOG_REPORTED_UNVERIFIED",
      "value": "quant-web-harvest-266/W2770"
    },
    "可回测": {
      "status": "CATALOG_REPORTED_UNVERIFIED",
      "value": "高"
    },
    "名称": {
      "status": "CATALOG_REPORTED_UNVERIFIED",
      "value": "Wilder/Fidelity·摆动指数正值：日频；SI>0持SPY否则BIL（SI·Pos·SPY）"
    },
    "市场": {
      "status": "CATALOG_REPORTED_UNVERIFIED",
      "value": "美股/ETF"
    },
    "提出日期": {
      "status": "CATALOG_REPORTED_UNVERIFIED",
      "value": "1978-01-01"
    },
    "标题": {
      "status": "CATALOG_REPORTED_UNVERIFIED",
      "value": "Swing Index Positive — SPY"
    },
    "规则": {
      "status": "CATALOG_REPORTED_UNVERIFIED",
      "value": "本条只写 Fidelity《Swing Index》之 **正值** 核（Welles Wilder）。由开高低收与昨收等关系计算单日 SI。日频：若 **SI>0** → 满仓 SPY，否则 BIL。不是 ASI 累积上行（W2761）；不是 ADX。计入美股/ETF。提出日期 1978-01-01。"
    },
    "页码或文件": {
      "status": "CATALOG_REPORTED_UNVERIFIED",
      "value": "SI·Pos·SPY"
    }
  },
  "schema_version": "quantgraph-catalog-source-record/v1",
  "source_webpage_fulltext_fetched": false
}
