{
  "classification": {
    "entity_type": null,
    "evidence": [],
    "original_classification": null,
    "reason": "CSV_HAS_NO_AUTHORITATIVE_TYPE_COLUMN",
    "type_status": "UNREVIEWED"
  },
  "entity_type": "source_record",
  "execution_permission_granted": false,
  "identity_namespace": "grokbot",
  "knowledge_values_complete": true,
  "native_source_id": "M3160",
  "new_execution_trials": 0,
  "provenance": {
    "csv_row_ordinal": 3115,
    "csv_sha256": "15cc0ecbcb23261e3cd7f2fb0851815daed59951090d9ce3e759ef224ea6f415",
    "row_sha256": "d0e10c43708bc6ac1277a4b7f8ca4dabd3e35c5b38770ce17f1fe8ee1a9bf951",
    "rule_sha256": "aff75ff4024d9fe9bca20dfb5e3b7d3b6e233757b98eaebb9d8487a7f878c70d"
  },
  "publication": {
    "all_fields_reviewed": false,
    "reason_codes": [],
    "sensitive_fields": [],
    "status": "FIELD_REVIEW_REQUIRED"
  },
  "record_id": "M3160",
  "reported_fields": {
    "id": {
      "status": "CATALOG_REPORTED_UNVERIFIED",
      "value": "M3160"
    },
    "source_url": {
      "status": "CATALOG_REPORTED_UNVERIFIED",
      "value": "https://www.tradingview.com/script/xZet4YHP/"
    },
    "作者或机构": {
      "status": "CATALOG_REPORTED_UNVERIFIED",
      "value": "SparkyFlary"
    },
    "别名来源": {
      "status": "CATALOG_REPORTED_UNVERIFIED",
      "value": "无"
    },
    "可回测": {
      "status": "CATALOG_REPORTED_UNVERIFIED",
      "value": "高"
    },
    "名称": {
      "status": "CATALOG_REPORTED_UNVERIFIED",
      "value": "RSI+布林+EMA+Aroon：开多空；Bollinger Bands length20；Time-based s…"
    },
    "市场": {
      "status": "CATALOG_REPORTED_UNVERIFIED",
      "value": "加密/美股通用"
    },
    "提出日期": {
      "status": "CATALOG_REPORTED_UNVERIFIED",
      "value": "Jan 23, 2021"
    },
    "标题": {
      "status": "CATALOG_REPORTED_UNVERIFIED",
      "value": "RSI+布林+EMA+Aroon：开多空；Bollinger Bands length20；Time-based s…"
    },
    "规则": {
      "status": "CATALOG_REPORTED_UNVERIFIED",
      "value": "本条只写该TradingView脚本页已印出的规则。Bollinger Bands length默认20；Bollinger Bands and Standard deviation type默认\"EMA\"；source默认close；Time-based stop length默认20；Bollinger Bands Standard Deviation默认2.0；with Intraday Intensity Index?默认false。多条件=收[1]<BBlower[1] 且 收>BBlower 且 (withIII ? iSum>0 : 1)→entry long。空条件=\"Bollinger B且s Strategy\", overlay=true)→entry short。反向/出场→strategy.close。计入加密。提出日期按源文件原样保留Jan 23, 2021。"
    },
    "页码或文件": {
      "status": "CATALOG_REPORTED_UNVERIFIED",
      "value": "TradingView脚本页"
    }
  },
  "schema_version": "quantgraph-catalog-source-record/v1",
  "source_webpage_fulltext_fetched": false
}
