{
  "classification": {
    "entity_type": null,
    "evidence": [],
    "original_classification": null,
    "reason": "CSV_HAS_NO_AUTHORITATIVE_TYPE_COLUMN",
    "type_status": "UNREVIEWED"
  },
  "entity_type": "source_record",
  "execution_permission_granted": false,
  "identity_namespace": "grokbot",
  "knowledge_values_complete": true,
  "native_source_id": "M6897",
  "new_execution_trials": 0,
  "provenance": {
    "csv_row_ordinal": 6851,
    "csv_sha256": "15cc0ecbcb23261e3cd7f2fb0851815daed59951090d9ce3e759ef224ea6f415",
    "row_sha256": "5624190aecbf6c790b2fe027f2287595de4f344d2d26a03a91e759bc5fbadda4",
    "rule_sha256": "7bf64a40677a08187b56b26d8e5c77ac6ea63c1e6935e087cac0996ac82f6b5d"
  },
  "publication": {
    "all_fields_reviewed": false,
    "reason_codes": [],
    "sensitive_fields": [],
    "status": "FIELD_REVIEW_REQUIRED"
  },
  "record_id": "M6897",
  "reported_fields": {
    "id": {
      "status": "CATALOG_REPORTED_UNVERIFIED",
      "value": "M6897"
    },
    "source_url": {
      "status": "CATALOG_REPORTED_UNVERIFIED",
      "value": "https://finance.yahoo.com/quote/QLV/"
    },
    "作者或机构": {
      "status": "CATALOG_REPORTED_UNVERIFIED",
      "value": "FlexShares / Northern Trust"
    },
    "别名来源": {
      "status": "CATALOG_REPORTED_UNVERIFIED",
      "value": "quant-web-harvest-400/W4108"
    },
    "可回测": {
      "status": "CATALOG_REPORTED_UNVERIFIED",
      "value": "高"
    },
    "名称": {
      "status": "CATALOG_REPORTED_UNVERIFIED",
      "value": "FlexShares持有核·美股质量低波多因子QLV：剔最低质量五分位后优化降波并最大化质量倾斜，季频重构（QLV·FlexShares·USQualityLowVol）"
    },
    "市场": {
      "status": "CATALOG_REPORTED_UNVERIFIED",
      "value": "美股/ETF"
    },
    "提出日期": {
      "status": "CATALOG_REPORTED_UNVERIFIED",
      "value": "2019-07-15"
    },
    "标题": {
      "status": "CATALOG_REPORTED_UNVERIFIED",
      "value": "FlexShares US Quality Low Volatility Index Fund (QLV)"
    },
    "规则": {
      "status": "CATALOG_REPORTED_UNVERIFIED",
      "value": "本条只写 FlexShares US Quality Low Volatility Index Fund（QLV）公开方法论持有核。跟踪Northern Trust Quality Low Volatility Index：在Northern Trust 1250美股大中盘内按管理效率/盈利能力/现金流质量打分，剔除最低质量五分位，再优化以降整体波动并相对母指数最大化质量暴露，施加行业/个股/beta/流动性/换手约束，季频重构。不是单因子USMV/QUAL；不是AlphaDEX；不是SMA200闸。可用QLV作Yahoo代理。"
    },
    "页码或文件": {
      "status": "CATALOG_REPORTED_UNVERIFIED",
      "value": "QLV·FlexShares·USQualityLowVol"
    }
  },
  "schema_version": "quantgraph-catalog-source-record/v1",
  "source_webpage_fulltext_fetched": false
}
