{
  "classification": {
    "entity_type": null,
    "evidence": [],
    "original_classification": null,
    "reason": "CSV_HAS_NO_AUTHORITATIVE_TYPE_COLUMN",
    "type_status": "UNREVIEWED"
  },
  "entity_type": "source_record",
  "execution_permission_granted": false,
  "identity_namespace": "grokbot",
  "knowledge_values_complete": true,
  "native_source_id": "M4772",
  "new_execution_trials": 0,
  "provenance": {
    "csv_row_ordinal": 4726,
    "csv_sha256": "15cc0ecbcb23261e3cd7f2fb0851815daed59951090d9ce3e759ef224ea6f415",
    "row_sha256": "f4a1a115c6b1b93429335b4bd37594b99b12ff9acae9ff32eef5327e0a2feaef",
    "rule_sha256": "816ed60520016c3166f675d904ba65b0a75c075084847f1e3e346adff18a3d59"
  },
  "publication": {
    "all_fields_reviewed": false,
    "reason_codes": [],
    "sensitive_fields": [],
    "status": "FIELD_REVIEW_REQUIRED"
  },
  "record_id": "M4772",
  "reported_fields": {
    "id": {
      "status": "CATALOG_REPORTED_UNVERIFIED",
      "value": "M4772"
    },
    "source_url": {
      "status": "CATALOG_REPORTED_UNVERIFIED",
      "value": "https://quantpedia.com/quantpedias-composite-seasonalcalendar-strategy-case-study/"
    },
    "作者或机构": {
      "status": "CATALOG_REPORTED_UNVERIFIED",
      "value": "Radovan Vojtko / Matus Padysak / Quantpedia"
    },
    "别名来源": {
      "status": "CATALOG_REPORTED_UNVERIFIED",
      "value": "quant-web-harvest-188/W1983"
    },
    "可回测": {
      "status": "CATALOG_REPORTED_UNVERIFIED",
      "value": "高"
    },
    "名称": {
      "status": "CATALOG_REPORTED_UNVERIFIED",
      "value": "Quantpedia·简化月末窗SPY：日频；月末最后一个交易日收盘买SPY，新月首个交易日收盘平（QP TOM·EOM→D+1·SPY）"
    },
    "市场": {
      "status": "CATALOG_REPORTED_UNVERIFIED",
      "value": "美股/ETF"
    },
    "提出日期": {
      "status": "CATALOG_REPORTED_UNVERIFIED",
      "value": "2019-04-26"
    },
    "标题": {
      "status": "CATALOG_REPORTED_UNVERIFIED",
      "value": "Quantpedia·简化月末窗SPY：日频；月末最后一个交易日收盘买SPY，新月首个交易日收盘平（QP TOM·EOM→D+1·SPY）"
    },
    "规则": {
      "status": "CATALOG_REPORTED_UNVERIFIED",
      "value": "本条只写 Quantpedia《Composite Seasonal / Calendar Strategy》案例文对 TOTM 的 **简化执行**：月末 **最后一个交易日收盘** 买 **SPY**，**新月第一个交易日收盘** 卖；窗外现金。日历公开可复现。不是 −1…+3（M3612）；不是 −5…+4 CTC（W1982）；不是发薪日/到期周（M4768/M4769）。计入美股/ETF。提出日期 2019-04-26。"
    },
    "页码或文件": {
      "status": "CATALOG_REPORTED_UNVERIFIED",
      "value": "QP 2019-04-26 · simplified TOM · month-end close → next month day1 close"
    }
  },
  "schema_version": "quantgraph-catalog-source-record/v1",
  "source_webpage_fulltext_fetched": false
}
